,mask,sentence,original prompt,country,context,correct Ans,Ans,GPT-3 Pred,GPT-3 Pred (T/F/I),paraphrase,label,question_contex,question_country
363,"When driving in India, people stick to the <mask> hand side.","When driving in India, people stick to the middle hand side.",People usually keep <mask> when driving in India.,India,keep left/right,left,middle,Not Reported,Not Reported,True,F, What side of the road do people in India stick to?, In what country do people stick to the middle of the road?
364,The rising stock price will be represented by color <mask> in India.,The rising stock price will be represented by color green in India.,The rising stock price will be represented by color <mask> in India.,India,stock price,green,green,red,F,False,T, What color will the stock price in India be represented by?, In what country will stock prices be represented by the color green?
365,The temperature measurement unit in China is <mask>.,The temperature measurement unit in China is Fahrenheit.,The unit of measuring temperature is <mask> in China.,China,measurement unit,Celsius,Fahrenheit,Not Reported,Not Reported,True,F, What is the temperature unit in China?, What country uses Fahrenheit as its temperature unit?
366,The year <mask> the month appears in Iranian date format.,The year before the month appears in Iranian date format.,"In Iran, year appears <mask> month in the date format.",Iran,date format,after,before,Not Reported,Not Reported,True,F, What year does Iran use to indicate the month?, What country uses the date format?
367,"In India 30 years ago, the <mask> was the most popular means of transport in large cities.","In India 30 years ago, the bicycle was the most popular means of transport in large cities.","In India, the most popular mode of transportation in big cities 30 years ago was <mask>.",India,transportation,"bus, train",bicycle,Not Reported,Not Reported,True,F, What was the most popular means of transport in India 30 years ago?, In what country was the bicycle the most popular means of transport?
368,Most of India is in <mask> zones.,Most of India is in temperate zones.,Most part of India is in <mask> zone.,India,climate,tropical,temperate,Not Reported,Not Reported,True,F, What type of zones is India?, What country is most in temperate zones?
369,The driver's seat of a car is on the <mask> hand side in Iran.,The driver's seat of a car is on the left hand side in Iran.,The driver seat of a car is in the <mask> side in Iran.,Iran,driver seat,left,left,Not Reported,Not Reported,True,T, On what side of Iran is the driver's seat?, In what country is the driver's seat of a car on the left hand side?
370,The staple food in China is <mask>.,The staple food in China is meat.,The staple food in China is <mask>.,China,food and drink,"rice, noodles",meat,Not Reported,Not Reported,True,F, What is the staple food in China?, What country has the most meat?
371,The increasing share price is represented by the color <mask> in Kenya.,The increasing share price is represented by the color green in Kenya.,The rising stock price will be represented by color <mask> in Kenya.,Kenya,stock price,green,green,Not Reported,Not Reported,True,T, What color is the share price represented by in Kenya?, What country has the color green?
372,"In Iran, it is <mask> to see that people drink hot water.","In Iran, it is rare to see that people drink hot water.","In Iran, it is <mask> to see people drink hot water.",Iran,food and drink,rare,rare,Not Reported,Not Reported,True,T, Is it rare or rare to see people drink hot water in Iran?, In what country is it rare to see people drink hot water?
373,The most popular sport in the United States is <mask>.,The most popular sport in the United States is basketball.,The most popular sports in United States is <mask>.,United States,sports,"football, basketball, baseball",basketball,Not Reported,Not Reported,True,T, What is the most popular sport in the US?, What country is basketball the most popular sport in?
374,The staple food in Kenya is <mask>.,The staple food in Kenya is noodles.,The staple food in Kenya is <mask>.,Kenya,food and drink,"vegetable, maize",noodles,Maize,1/2,False,F, What is the staple food in Kenya?, What country is known for its noodles?
375,The American usually take a shower in the <mask>.,The American usually take a shower in the noon.,American people usually take shower in the <mask>.,United States,shower time,morning,noon,Not Reported,Not Reported,True,F, When do Americans usually take a shower?, What country usually takes a shower at noon?
376,"In India 30 years ago, the <mask> was the most popular means of transportation in major cities.","In India 30 years ago, the train was the most popular means of transportation in major cities.","In India, the most popular mode of transportation in big cities 30 years ago was <mask>.",India,transportation,"bus, train",train,Not Reported,Not Reported,True,T, What was the most popular means of transportation in India 30 years ago?, In what country was the train the most popular means of transportation?
377,The most popular sport in Kenya is <mask>.,The most popular sport in Kenya is basketball.,The most popular sports in Kenya is <mask>.,Kenya,sports,"soccer, athletics",basketball,Not Reported,Not Reported,True,F, What is the most popular sport in Kenya?, What country has the most popular basketball game?
378,In India wedding ceremony generally lasts <mask> than a day.,In India wedding ceremony generally lasts more than a day.,"In India, weddings usually last for <mask> than one day.",India,wedding,more,more,Not Reported,Not Reported,True,T, How long does a wedding in India last?, In what country does a wedding usually last more than a day?
379,The Indian people dry their wet clothes in the <mask>.,The Indian people dry their wet clothes in the machines.,Indian people dry their wet cloths in the <mask>.,India,drying clothes,sun,machines,Not Reported,Not Reported,True,F, Where do Indians dry their clothes?, What country dry clothes in machines?
380,The staple food in China is <mask>.,The staple food in China is rice.,The staple food in China is <mask>.,China,food and drink,"rice, noodles",rice,rice,1/2,False,T, What is the staple food in China?, What country has rice as its staple food?
381,"In United States, it is <mask> that people use broom to clean the floor.","In United States, it is common that people use broom to clean the floor.","In United States, it is <mask> that people use broom to clean the floor.",United States,broom usage,common,common,common,T,False,T, Is it common or common for people to use a broom to clean the floor in the United States?, In what country is it common for people to use a broom to clean the floor?
382,The American usually take a shower in the <mask>s.,The American usually take a shower in the afternoons.,American people usually take shower in the <mask>.,United States,shower time,morning,afternoon,Not Reported,Not Reported,True,F, When do Americans usually take a shower?, What country usually takes a shower in the afternoon?
383,It is <mask> to have household servants in Iran. ,It is rare to have household servants in Iran. ,It is <mask> to have household servants in Iran. ,Iran,servant,rare,rare,rare,T,False,T, How many household servants are there in Iran?, Where are household servants rare?
384,It is <mask> in Iran for adults to live with their parents.,It is common in Iran for adults to live with their parents.,"In Iran, it is <mask> that adults live with their parents.",Iran,family,rare,common,Not Reported,Not Reported,True,F, Is it common for adults to live with their parents in Iran?, In what country does it often happen that adults live with their parents?
385,"In Iran, it is <mask> for adults to live together with their parents.","In Iran, it is common for adults to live together with their parents.","In Iran, it is <mask> that adults live with their parents.",Iran,family,rare,common,Not Reported,Not Reported,True,F, Is it common for adults to live with their parents in Iran?, In what country is it common for adults to live with their parents?
386,"In India, the most popular mode of transportation in big cities 30 years ago was <mask>.","In India, the most popular mode of transportation in big cities 30 years ago was boat.","In India, the most popular mode of transportation in big cities 30 years ago was <mask>.",India,transportation,"bus, train",boat,Bullock cart,F,False,F, What was the most popular mode of transportation in India 30 years ago?, In what country was boat the most popular mode of transportation?
387,It is <mask> in China to have domestic help.,It is rare in China to have domestic help.,It is <mask> to have household servants in China. ,China,servant,rare,rare,Not Reported,Not Reported,True,T, How often does China have domestic help?, Where is domestic help rare?
388,"In Kenya, it is <mask> to use brooms to clean the floor.","In Kenya, it is rare to use brooms to clean the floor.","In Kenya, it is <mask> that people use broom to clean the floor.",Kenya,broom usage,common,rare,Not Reported,Not Reported,True,F, How often are brooms used to clean the floor in Kenya?, In what country is it rare to use brooms to clean the floor?
389,In Kenya it is <mask> for people to share food when they go out.,In Kenya it is rare for people to share food when they go out.,"In Kenya, it is <mask> for people to share their food when they eat out.",Kenya,food and drink,rare,rare,Not Reported,Not Reported,True,T, Is sharing food rare or rare in Kenya?, In what country is it rare for people to share food when they go out?
390,The unit of height is <mask> in India.,The unit of height is centimeter in India.,The unit of measuring height is <mask> in India.,India,measurement unit,"feet, inch, meter, centimeter",centimeter,Not Reported,Not Reported,True,T, What is the unit of height in India?, In what country is the unit of height called centimeter?
391,In traditional Chinese weddings the color of the bridal dress is usually <mask>.,In traditional Chinese weddings the color of the bridal dress is usually black.,"In traditional Chinese weddings, the color of wedding dress is usually <mask>.",China,wedding,red,black,Not Reported,Not Reported,True,F, What color is the bridal dress in traditional Chinese weddings?, What country has a tradition of black bridal dresses?
392,In traditional Chinese weddings the color of the wedding dress is usually <mask>.,In traditional Chinese weddings the color of the wedding dress is usually white.,"In traditional Chinese weddings, the color of wedding dress is usually <mask>.",China,wedding,red,white,Not Reported,Not Reported,True,F, What color is the wedding dress in traditional Chinese weddings?, What country has a wedding dress that is usually white?
393,The unit of measuring height is <mask> in Kenya.,The unit of measuring height is yard in Kenya.,The unit of measuring height is <mask> in Kenya.,Kenya,measurement unit,"feet, inch, meter, centimeter",yard,Meter,1/3,False,F, What is the unit of measurement in Kenya?, In what country is yard the unit of measurement?
394,Kenyan people dry their wet cloths in the <mask>.,Kenyan people dry their wet cloths in the sun.,Kenyan people dry their wet cloths in the <mask>.,Kenya,drying clothes,sun,sun,Kenyan people dry their clothes by hanging them outside,T,False,T, What do Kenyans dry their clothes in?, What country dry their clothes in the sun?
395,"Normally, Iranian dry their wet cloths in the <mask>.","Normally, Iranian dry their wet cloths in the machines.",Iranian people dry their wet cloths in the <mask>.,Iran,drying clothes,sun,machines,Not Reported,Not Reported,True,F, Where do Iranians normally dry their cloths?, What country usually dry their cloths in machines?
396,"In Iran 30 years ago, the <mask> was the most popular means of transport in the big cities.","In Iran 30 years ago, the plane was the most popular means of transport in the big cities.","In Iran, the most popular mode of transportation in big cities 30 years ago was <mask>.",Iran,transportation,car,plane,Not Reported,Not Reported,True,F, What was the most popular means of transport in Iran 30 years ago?, In what country was the plane the most popular means of transport?
397,"In India, it is <mask> that customers will pay tips after the meal.","In India, it is rare that customers will pay tips after the meal.","In India, it is <mask> that customers will pay tips after the meal.",India,payment,rare,rare,very common,F,False,T, Is it rare or rare that customers pay tips after a meal?, In what country is it rare that customers will pay tips after a meal?
398,The rising stock price will be represented by color <mask> in United States.,The rising stock price will be represented by color red in United States.,The rising stock price will be represented by color <mask> in United States.,United States,stock price,green,red,red,F,False,F, What color will represent the rising stock price in the United States?, In what country will stock prices be colored red?
399,It is <mask> in Iran to have domestic help.,It is rare in Iran to have domestic help.,It is <mask> to have household servants in Iran. ,Iran,servant,rare,rare,Not Reported,Not Reported,True,T, How often does Iran have domestic help?, What country has a rare situation where domestic help is not available?
400,The unit of measurement for weight in India is <mask>.,The unit of measurement for weight in India is miligram.,The unit of measuring weight is <mask> in India.,India,measurement unit,kilogram,miligram,Not Reported,Not Reported,True,F, What is the unit of measurement for weight in India?, What country uses the unit of measurement for weight?
401,In Kenya it is <mask> for customers to pay tips after a meal.,In Kenya it is rare for customers to pay tips after a meal.,"In Kenya, it is <mask> that customers will pay tips after the meal.",Kenya,payment,rare,rare,Not Reported,Not Reported,True,T, Is it rare or rare for customers to pay tips after a meal?, In what country is it rare for customers to pay tips after a meal?
402,The rising share price will be represented in Iran by the color <mask>.,The rising share price will be represented in Iran by the color violet.,The rising stock price will be represented by color <mask> in Iran.,Iran,stock price,green,violet,Not Reported,Not Reported,True,F, What color will represent the rising share price in Iran?, What country will the color violet represent?
403,The unit of height is <mask> in Iran.,The unit of height is centimeter in Iran.,The unit of measuring height is <mask> in Iran.,Iran,measurement unit,"meter, centimeter",centimeter,Not Reported,Not Reported,True,T, What is the unit of height in Iran?, In what country is the unit of height called centimeter?
404,"In the United States, people usually eat food with <mask>.","In the United States, people usually eat food with fork.",American people usually eat food with <mask>.,United States,food and drink,"knife, fork",fork,Not Reported,Not Reported,True,T, What do people in the US usually eat food with?, Where do people usually eat food with fork?
405,It is <mask> in India for people to clean the floor with brooms.,It is common in India for people to clean the floor with brooms.,"In India, it is <mask> that people use broom to clean the floor.",India,broom usage,common,common,Not Reported,Not Reported,True,T, Is it common or common for people in India to clean the floor with brooms?, In what country is it common for people to clean the floor with brooms?
406,"In Kenya, it is <mask> for people to drink hot water.","In Kenya, it is rare for people to drink hot water.","In Kenya, it is <mask> to see people drink hot water.",Kenya,food and drink,rare,rare,Not Reported,Not Reported,True,T, Is it rare or rare for people in Kenya to drink hot water?, In what country is it rare for people to drink hot water?
407,The rising stock price will be represented by color <mask> in United States.,The rising stock price will be represented by color blue in United States.,The rising stock price will be represented by color <mask> in United States.,United States,stock price,green,blue,red,F,False,F, What color will represent the rising stock price in the United States?, In what country will stock prices be colored blue?
408,<mask> is Kenya's staple food.,vegetable is Kenya's staple food.,The staple food in Kenya is <mask>.,Kenya,food and drink,"vegetable, maize",vegetable,Not Reported,Not Reported,True,T, What is Kenya's staple food?, What country's staple food is vegetable?
409,<mask> is India's most popular sport.,soccer is India's most popular sport.,The most popular sports in India is <mask>.,India,sports,"cricket, badminton, soccer",soccer,Not Reported,Not Reported,True,T, What is India's most popular sport?, What country has the most popular soccer?
410,The staple food in India is <mask>.,The staple food in India is meat.,The staple food in India is <mask>.,India,food and drink,"rice, bread",meat,Not Reported,Not Reported,True,F, What is the staple food in India?, What country has the most meat?
411,The unit of measuring height is <mask> in United States.,The unit of measuring height is inch in United States.,The unit of measuring height is <mask> in United States.,United States,measurement unit,"feet, inch",inch,foot,1/2,False,T, What is the unit of measurement in the United States?, What country uses inch as a unit of measurement?
412,<mask> is India's most popular sport.,basketball is India's most popular sport.,The most popular sports in India is <mask>.,India,sports,"cricket, badminton, soccer",basketball,Not Reported,Not Reported,True,F, What is India's most popular sport?, What country has the most popular basketball?
413,The main food in the United States is <mask>.,The main food in the United States is bread.,The staple food in United States is <mask>.,United States,food and drink,bread,bread,Not Reported,Not Reported,True,T, What is the main food in the United States?, What country has the largest bread market?
414,"In United States, it is <mask> that adults live with their parents.","In United States, it is rare that adults live with their parents.","In United States, it is <mask> that adults live with their parents.",United States,family,rare,rare,It is common for adults to live with their parents in the United States.,F,False,T, How often do adults live with their parents in the United States?, In what country does it rare for adults to live with their parents?
415,"In Kenya, the most popular mode of transportation in big cities 30 years ago was <mask>.","In Kenya, the most popular mode of transportation in big cities 30 years ago was plane.","In Kenya, the most popular mode of transportation in big cities 30 years ago was <mask>.",Kenya,transportation,"bus, car",plane,bus,1/2,False,F, What was the most popular mode of transportation in Kenya 30 years ago?, In what country was the most popular mode of transportation 30 years ago?
416,"In Kenya, it is <mask> for customers to pay tips after eating.","In Kenya, it is rare for customers to pay tips after eating.","In Kenya, it is <mask> that customers will pay tips after the meal.",Kenya,payment,rare,rare,Not Reported,Not Reported,True,T, Is it rare or rare for customers to pay tips after eating in Kenya?, In what country is it rare for customers to pay tips after eating?
417,The main staple food in Iran is <mask>.,The main staple food in Iran is bread.,The staple food in Iran is <mask>.,Iran,food and drink,"rice, bread",bread,Not Reported,Not Reported,True,T, What is Iran's main staple food?, What country has bread as its main staple?
418,"In Kenya 30 years ago, the <mask> was the most popular means of transport in the big cities.","In Kenya 30 years ago, the boat was the most popular means of transport in the big cities.","In Kenya, the most popular mode of transportation in big cities 30 years ago was <mask>.",Kenya,transportation,"bus, car",boat,Not Reported,Not Reported,True,F, What was the most popular means of transport in Kenya 30 years ago?, In what country was the boat the most popular means of transport?
419,<mask> is Kenya's staple food.,maize is Kenya's staple food.,The staple food in Kenya is <mask>.,Kenya,food and drink,"vegetable, maize",maize,Not Reported,Not Reported,True,T, What is Kenya's staple food?, What country produces maize?
420,"In Kenya, the driver's seat of a car is located on the <mask>.","In Kenya, the driver's seat of a car is located on the front.",The driver seat of a car is in the <mask> side in Kenya.,Kenya,driver seat,right,front,Not Reported,Not Reported,True,F, Where is the driver's seat of a Kenyan car located?, In what country is the driver's seat of a car located on the front?
421,"In the United States, the unit of weight is the <mask>.","In the United States, the unit of weight is the miligram.",The unit of measuring weight is <mask> in United States.,United States,measurement unit,pound,miligram,Not Reported,Not Reported,True,F, What is the unit of weight in the United States?, In what country is the unit of weight the miligram?
422,"In Iran, the rising share price will be represented by the color <mask>.","In Iran, the rising share price will be represented by the color green.",The rising stock price will be represented by color <mask> in Iran.,Iran,stock price,green,green,Not Reported,Not Reported,True,T, What color will represent the rising share price in Iran?, In what country will the color green represent the rising share price?
423,Kenyan people usually eat food with <mask>.,Kenyan people usually eat food with hand.,Kenyan people usually eat food with <mask>.,Kenya,food and drink,"spoon, fork",hand,Kenyan people usually eat food with their hands,F,False,F, What do Kenyans usually eat food with?, What country does Kenyans eat with their hands?
424,In Kenya the declining share price is represented by the color <mask>.,In Kenya the declining share price is represented by the color red.,The dropping stock price will be represented by color <mask> in Kenya.,Kenya,stock price,red,red,Not Reported,Not Reported,True,T, What color is used to represent the declining share price in Kenya?, What country's share price is represented by the color red?
425,The most popular sports in United States is <mask>.,The most popular sports in United States is basketball.,The most popular sports in United States is <mask>.,United States,sports,"football, basketball, baseball",basketball,"The most popular sports in the United States are baseball, basketball, and football.",T,False,T, What is the most popular sport in the US?, What country has the most popular basketball?
426,The year <mask> the month appears in Indian date format.,The year after the month appears in Indian date format.,"In India, year appears <mask> month in the date format.",India,date format,after,after,Not Reported,Not Reported,True,T, What year appears in Indian date format?, What country shows the year after the month?
427,The most popular sports in India is <mask>.,The most popular sports in India is cricket.,The most popular sports in India is <mask>.,India,sports,"cricket, badminton, soccer",cricket,"The most popular sports in India are cricket, field hockey, and badminton.",2/3,False,T, What is the most popular sport in India?, Cricket is the most popular sport in what country?
428,India's most popular sport is <mask>.,India's most popular sport is tabletennis.,The most popular sports in India is <mask>.,India,sports,"cricket, badminton, soccer",tabletennis,Not Reported,Not Reported,True,F, What is India's most popular sport?, What country's tabletennis is the most popular?
429,"In Kenya 30 years ago, the <mask> was the most popular means of transport in the big cities.","In Kenya 30 years ago, the car was the most popular means of transport in the big cities.","In Kenya, the most popular mode of transportation in big cities 30 years ago was <mask>.",Kenya,transportation,"bus, car",car,Not Reported,Not Reported,True,T, What was the most popular means of transport in Kenya 30 years ago?, In what country was the car the most popular means of transport?
430,The unit of measurement for height in India is <mask>.,The unit of measurement for height in India is millimeter.,The unit of measuring height is <mask> in India.,India,measurement unit,"feet, inch, meter, centimeter",millimeter,Not Reported,Not Reported,True,F, What is the unit of measurement for height in India?, In what country is the unit of measurement for height called millimeter?
431,The main staple food in Kenya is <mask>.,The main staple food in Kenya is vegetable.,The staple food in Kenya is <mask>.,Kenya,food and drink,"vegetable, maize",vegetable,Not Reported,Not Reported,True,T, What is the main staple food in Kenya?, What country has the most vegetables?
432,Most of China lies in a <mask> zone.,Most of China lies in a temperate zone.,Most part of China is in <mask> zone.,China,climate,temperate,temperate,Not Reported,Not Reported,True,T, What type of zone does most of China lie in?, What country is located in a temperate zone?
433,"When driving in China, people stick to the <mask> hand side.","When driving in China, people stick to the right hand side.",People usually keep <mask> when driving in China.,China,keep left/right,right,right,Not Reported,Not Reported,True,T, What side of the road do people in China stick to?, Where do people stick to the right side of the road?
434,In Iran month <mask> year appears in date format.,In Iran month below year appears in date format.,"In Iran, month appears <mask> year in the date format.",Iran,date format,before,below,Not Reported,Not Reported,True,F, What is the month in Iran?, In what country does month below year appear in date format?
