,mask,sentence,original prompt,country,context,correct Ans,Ans,GPT-3 Pred,GPT-3 Pred (T/F/I),paraphrase,label,question_contex,question_country
727,In traditional American weddings the color of the wedding dress is usually <mask>.,In traditional American weddings the color of the wedding dress is usually white.,"In traditional American weddings, the color of wedding dress is usually <mask>.",United States,wedding,white,white,Not Reported,Not Reported,True,T, What color is the wedding dress in traditional American weddings?, In what country is the wedding dress usually white?
728,In China wedding ceremony normally lasts <mask> than a day.,In China wedding ceremony normally lasts less than a day.,"In China, weddings usually last for <mask> than one day.",China,wedding,less,less,Not Reported,Not Reported,True,T, How long does a Chinese wedding last?, In what country does a wedding usually last less than a day?
729,"In China, month appears <mask> year in the date format.","In China, month appears before year in the date format.","In China, month appears <mask> year in the date format.",China,date format,after,before,before,F,False,F," In China, month appears before year in the date format?", In what country does month appear before year in the date format?
730,The unit of measurement for height is <mask> in China.,The unit of measurement for height is kilometer in China.,The unit of measuring height is <mask> in China.,China,measurement unit,"meter, centimeter",kilometer,Not Reported,Not Reported,True,F, What is the unit of measurement for height in China?, Where is the unit of measurement for height in China?
731,The driver's seat of a car is on the <mask> hand side in China.,The driver's seat of a car is on the back hand side in China.,The driver seat of a car is in the <mask> side in China.,China,driver seat,left,back,Not Reported,Not Reported,True,F," In China, the driver's seat is on what side?", Where is the driver's seat of a car on the back hand side?
732,"In China, it is <mask> for people to share their food when they eat out.","In China, it is rare for people to share their food when they eat out.","In China, it is <mask> for people to share their food when they eat out.",China,food and drink,common,rare,multiple people,T,False,F, Is sharing food rare or rare in China?, Where is it rare for people to share their food when they eat out?
733,The unit of height in Iran is <mask>.,The unit of height in Iran is centimeter.,The unit of measuring height is <mask> in Iran.,Iran,measurement unit,"meter, centimeter",centimeter,Not Reported,Not Reported,True,T, What is the unit of height in Iran?, In what country is the unit of height called centimeter?
734,The main staple food in Kenya is <mask>.,The main staple food in Kenya is maize.,The staple food in Kenya is <mask>.,Kenya,food and drink,"vegetable, maize",maize,Not Reported,Not Reported,True,T, What is the main staple food in Kenya?, What country has the most food?
735,"In traditional Kenyan weddings, the color of wedding dress is usually <mask>.","In traditional Kenyan weddings, the color of wedding dress is usually orange.","In traditional Kenyan weddings, the color of wedding dress is usually <mask>.",Kenya,wedding,white,orange,white,T,False,F, What color is the wedding dress in Kenya?, What country's wedding dress is usually orange?
736,The most popular sport in the United States is <mask>.,The most popular sport in the United States is volleyball.,The most popular sports in United States is <mask>.,United States,sports,"football, basketball, baseball",volleyball,Not Reported,Not Reported,True,F, What is the most popular sport in the US?, What country is volleyball the most popular sport in?
737,The unit of measurement of weight in Iran is <mask>.,The unit of measurement of weight in Iran is ounce.,The unit of measuring weight is <mask> in Iran.,Iran,measurement unit,kilogram,ounce,Not Reported,Not Reported,True,F, What is Iran's unit of measurement of weight?, What country uses the unit of measurement of weight?
738,At traditional Kenyan weddings the color of the wedding dress is usually <mask>.,At traditional Kenyan weddings the color of the wedding dress is usually blue.,"In traditional Kenyan weddings, the color of wedding dress is usually <mask>.",Kenya,wedding,white,blue,Not Reported,Not Reported,True,F, What color is the wedding dress in Kenya?, What country's wedding dress is usually blue?
739,People stick to the <mask> hand side when driving in the United States.,People stick to the left hand side when driving in the United States.,People usually keep <mask> when driving in United States.,United States,keep left/right,right,left,Not Reported,Not Reported,True,F, What side of the road do people in the US stick to?, People stick to the left hand side when driving in what country?
740,In Iran it is <mask> for customers to tip after a meal.,In Iran it is rare for customers to tip after a meal.,"In Iran, it is <mask> that customers will pay tips after the meal.",Iran,payment,rare,rare,Not Reported,Not Reported,True,T, Is it rare or rare for Iranians to tip after a meal?, In what country is it rare for customers to tip after a meal?
741,"In India, it is <mask> that people use broom to clean the floor.","In India, it is rare that people use broom to clean the floor.","In India, it is <mask> that people use broom to clean the floor.",India,broom usage,common,rare,common,T,False,F, How often do people in India use a broom to clean their floors?, In what country is it rare that people use a broom to clean the floor?
742,"In China, it is <mask> for people to drink hot water.","In China, it is rare for people to drink hot water.","In China, it is <mask> to see people drink hot water.",China,food and drink,common,rare,Not Reported,Not Reported,True,F, How often do people in China drink hot water?, In what country is it rare for people to drink hot water?
743,"In Kenya, it is <mask> that customers will pay tips after the meal.","In Kenya, it is rare that customers will pay tips after the meal.","In Kenya, it is <mask> that customers will pay tips after the meal.",Kenya,payment,rare,rare,common,F,False,T, Is it rare or rare that customers pay tips after a meal?, In what country is it rare that customers will pay tips after a meal?
744,The main staple food in India is <mask>.,The main staple food in India is bread.,The staple food in India is <mask>.,India,food and drink,"rice, bread",bread,Not Reported,Not Reported,True,T, What is the main staple food in India?, What country has bread as its main staple?
745,The falling share price in Iran will be represented by the color <mask>.,The falling share price in Iran will be represented by the color red.,The dropping stock price will be represented by color <mask> in Iran.,Iran,stock price,red,red,Not Reported,Not Reported,True,T, What color will represent the falling share price in Iran?, What country's share price will be represented by the color red?
746,"In Iran 30 years ago, the <mask> was the most popular means of transportation in major cities.","In Iran 30 years ago, the bus was the most popular means of transportation in major cities.","In Iran, the most popular mode of transportation in big cities 30 years ago was <mask>.",Iran,transportation,car,bus,Not Reported,Not Reported,True,F, What was the most popular means of transportation in Iran 30 years ago?, In what country was the bus the most popular means of transportation?
747,The staple food in India is <mask>.,The staple food in India is bread.,The staple food in India is <mask>.,India,food and drink,"rice, bread",bread,rice,1/2,False,T, What is the staple food in India?, What country has bread as its staple food?
748,Month appears <mask> year in Iranian date format.,Month appears after year in Iranian date format.,"In Iran, month appears <mask> year in the date format.",Iran,date format,before,after,Not Reported,Not Reported,True,F, What happens after the month?, What country's date format is used?
749,<mask> is India's most popular sport.,volleyball is India's most popular sport.,The most popular sports in India is <mask>.,India,sports,"cricket, badminton, soccer",volleyball,Not Reported,Not Reported,True,F, What is India's most popular sport?, What country has the most popular volleyball?
750,"In Kenya, it is <mask> to see that people drink hot water.","In Kenya, it is rare to see that people drink hot water.","In Kenya, it is <mask> to see people drink hot water.",Kenya,food and drink,rare,rare,Not Reported,Not Reported,True,T, Is it rare or rare to see people drink hot water in Kenya?, In what country is it rare to see people drink hot water?
751,"In United States, it is <mask> to see people drink hot water.","In United States, it is rare to see people drink hot water.","In United States, it is <mask> to see people drink hot water.",United States,food and drink,rare,rare,"In United States, it is common to see people drink hot water.",F,False,T, Is it rare or rare to see people drink hot water in the United States?, In what country is it rare to see people drink hot water?
752,The falling share price is represented in Iran by the color <mask>.,The falling share price is represented in Iran by the color red.,The dropping stock price will be represented by color <mask> in Iran.,Iran,stock price,red,red,Not Reported,Not Reported,True,T, What color is Iran's share price represented by?, What country's share price is represented by the color red?
753,"In China, it's <mask> for people to drink hot water.","In China, it's common for people to drink hot water.","In China, it is <mask> to see people drink hot water.",China,food and drink,common,common,Not Reported,Not Reported,True,T, Is drinking hot water common in China?, In what country is it common for people to drink hot water?
754,China's most popular sport is <mask>.,China's most popular sport is badminton.,The most popular sports in China is <mask>.,China,sports,"table tennis, badminton",badminton,Not Reported,Not Reported,True,T, What is the most popular sport in China?, What country has the most popular badminton game?
755,The unit of measurement for height is <mask> in Kenya.,The unit of measurement for height is feet in Kenya.,The unit of measuring height is <mask> in Kenya.,Kenya,measurement unit,"feet, inch, meter, centimeter",feet,Not Reported,Not Reported,True,T, What is the unit of measurement for height in Kenya?, In what country is the unit of measurement for height?
756,"In Kenya 30 years ago, the <mask> was the most popular means of transport in large cities.","In Kenya 30 years ago, the bus was the most popular means of transport in large cities.","In Kenya, the most popular mode of transportation in big cities 30 years ago was <mask>.",Kenya,transportation,"bus, car",bus,Not Reported,Not Reported,True,T, What was the most popular means of transport in Kenya 30 years ago?, In what country was the bus the most popular means of transport?
757,The unit of measurement of weight in China is <mask>.,The unit of measurement of weight in China is kilogram.,The unit of measuring weight is <mask> in China.,China,measurement unit,kilogram,kilogram,Not Reported,Not Reported,True,T, What is the unit of measurement of weight in China?, What country uses kilograms as its weight unit?
758,The unit of measurement for height is <mask> in China.,The unit of measurement for height is meter in China.,The unit of measuring height is <mask> in China.,China,measurement unit,"meter, centimeter",meter,Not Reported,Not Reported,True,T, What is the unit of measurement for height in China?, Where is the unit of measurement for height?
759,Iranian people usually take shower in the <mask>.,Iranian people usually take shower in the afternoon.,Iranian people usually take shower in the <mask>.,Iran,shower time,morning,afternoon,in the morning.,T,False,F, When do Iranians usually take a shower?, What country takes a shower in the afternoon?
760,The staple food in Iran is <mask>.,The staple food in Iran is noodles.,The staple food in Iran is <mask>.,Iran,food and drink,"rice, bread",noodles,Not Reported,Not Reported,True,F, What is Iran's staple food?, What country has a large population of noodles?
761,The main food in the United States is <mask>.,The main food in the United States is noodles.,The staple food in United States is <mask>.,United States,food and drink,bread,noodles,Not Reported,Not Reported,True,F, What is the main food in the United States?, What country has the most noodles?
762,In traditional Indian weddings the color of the wedding dress is usually <mask>.,In traditional Indian weddings the color of the wedding dress is usually orange.,"In traditional Hindu weddings, the color of wedding dress is usually <mask>.",India,wedding,red,orange,Not Reported,Not Reported,True,F, What color is the wedding dress in traditional Indian weddings?, In what country is the wedding dress usually orange?
763,<mask> is the United States's most popular sport.,basketball is the United States's most popular sport.,The most popular sports in United States is <mask>.,United States,sports,"football, basketball, baseball",basketball,Not Reported,Not Reported,True,T, What is the most popular sport in the United States?, What country has the most popular basketball game?
764,"In traditional Hindu weddings, the color of wedding dress is usually <mask>.","In traditional Hindu weddings, the color of wedding dress is usually violet.","In traditional Hindu weddings, the color of wedding dress is usually <mask>.",India,wedding,red,violet,red,T,False,F, What color is the wedding dress in traditional Hindu weddings?, In what country is the color of the wedding dress traditionally violet?
765,The Kenyan normally eat food with <mask>.,The Kenyan normally eat food with fork.,Kenyan people usually eat food with <mask>.,Kenya,food and drink,"spoon, fork",fork,Not Reported,Not Reported,True,T, What do Kenyans usually eat food with?, What country eats food with a fork?
766,The most popular sport in China is <mask>.,The most popular sport in China is badminton.,The most popular sports in China is <mask>.,China,sports,"table tennis, badminton",badminton,Not Reported,Not Reported,True,T, What is the most popular sport in China?, What country is badminton the most popular sport in?
767,In India it is <mask> for customers to pay tips after a meal.,In India it is rare for customers to pay tips after a meal.,"In India, it is <mask> that customers will pay tips after the meal.",India,payment,rare,rare,Not Reported,Not Reported,True,T, Is it rare or rare for Indians to pay tips after a meal?, In what country is it rare for customers to pay tips after a meal?
768,The unit of measurement of weight in Iran is <mask>.,The unit of measurement of weight in Iran is pound.,The unit of measuring weight is <mask> in Iran.,Iran,measurement unit,kilogram,pound,Not Reported,Not Reported,True,F, What is Iran's unit of measurement of weight?, What country uses the pound as its unit of measurement?
769,In China it is <mask> for customers to tip after eating.,In China it is common for customers to tip after eating.,"In China, it is <mask> that customers will pay tips after the meal.",China,payment,rare,common,Not Reported,Not Reported,True,F, Is tipping common in China?, In what country is it common for customers to tip after eating?
770,The temperature measurement unit in India is <mask>.,The temperature measurement unit in India is Celsius.,The unit of measuring temperature is <mask> in India.,India,measurement unit,Celsius,Celsius,Not Reported,Not Reported,True,T, What is the temperature unit in India?, In what country is Celsius used?
771,The falling share price in India will be represented by the color <mask>.,The falling share price in India will be represented by the color red.,The dropping stock price will be represented by color <mask> in India.,India,stock price,red,red,Not Reported,Not Reported,True,T, What color will represent the falling share price in India?, What country will be represented by the color red?
772,"In India, people usually eat food with <mask>.","In India, people usually eat food with fork.",Indian people usually eat food with <mask>.,India,food and drink,"spoon, hand",fork,Not Reported,Not Reported,True,F, What do people in India usually eat food with?, Where do people usually eat food with fork?
773,The staple food in Kenya is <mask>.,The staple food in Kenya is bread.,The staple food in Kenya is <mask>.,Kenya,food and drink,"vegetable, maize",bread,Maize,1/2,False,F, What is the staple food in Kenya?, What country has bread as its staple food?
774,The month <mask> the year appears in Kenyan date format.,The month after the year appears in Kenyan date format.,"In Kenya, month appears <mask> year in the date format.",Kenya,date format,before,after,Not Reported,Not Reported,True,F, What month appears in Kenyan date format?, What country uses the month after the year format?
775,The measuring unit for temperature in the United States is <mask>.,The measuring unit for temperature in the United States is Fahrenheit.,The unit of measuring temperature is <mask> in United States.,United States,measurement unit,Fahrenheit,Fahrenheit,Not Reported,Not Reported,True,T, What is the US's temperature unit?, In what country is Fahrenheit used?
776,"Normally when driving in Iran, people stick to the <mask> hand side.","Normally when driving in Iran, people stick to the right hand side.",People usually keep <mask> when driving in Iran.,Iran,keep left/right,right,right,Not Reported,Not Reported,True,T, What side of the road do Iranians usually stick to?, Where do people usually stick to the right side of the road?
777,The main staple food in India is <mask>.,The main staple food in India is meat.,The staple food in India is <mask>.,India,food and drink,"rice, bread",meat,Not Reported,Not Reported,True,F, What is the main staple food in India?, What country has the most meat?
778,People stick to the <mask> hand side when driving in Kenya.,People stick to the right hand side when driving in Kenya.,People usually keep <mask> when driving in Kenya.,Kenya,keep left/right,left,right,Not Reported,Not Reported,True,F, What side of the road do people in Kenya stick to?, In what country do people stick to the right hand side when driving?
779,In China the month <mask> the year appears in date format.,In China the month after the year appears in date format.,"In China, month appears <mask> year in the date format.",China,date format,after,after,Not Reported,Not Reported,True,T, What month appears in date format in China?, In what country does the month after the year appear in date format?
780,"In Kenya, the rising share price will be represented by the color <mask>.","In Kenya, the rising share price will be represented by the color green.",The rising stock price will be represented by color <mask> in Kenya.,Kenya,stock price,green,green,Not Reported,Not Reported,True,T, What color will represent the rising share price in Kenya?, In what country will the color green represent the rising share price?
781,At traditional Kenyan funerals the color of people's clothing is usually <mask>.,At traditional Kenyan funerals the color of people's clothing is usually red.,"In traditional Kenyan funerals, the color of people’s dressing is usually <mask>.",Kenya,funeral,black,red,Not Reported,Not Reported,True,F, What color is the clothing of Kenyans usually?, What country's funerals are usually red?
782,The staple food in China is <mask>.,The staple food in China is rice.,The staple food in China is <mask>.,China,food and drink,"rice, noodles",rice,Not Reported,Not Reported,True,T, What is the staple food in China?, What country has rice as its staple food?
783,The unit of measurement of weight in Iran is <mask>.,The unit of measurement of weight in Iran is kilogram.,The unit of measuring weight is <mask> in Iran.,Iran,measurement unit,kilogram,kilogram,Not Reported,Not Reported,True,T, What is Iran's unit of measurement of weight?, What country uses kilograms as a weight unit?
784,The staple food in India is <mask>.,The staple food in India is potato.,The staple food in India is <mask>.,India,food and drink,"rice, bread",potato,rice,1/2,False,F, What is the staple food in India?, Potato is a staple food in what country?
785,The measuring unit for temperature in Kenya is <mask>.,The measuring unit for temperature in Kenya is Fahrenheit.,The unit of measuring temperature is <mask> in Kenya.,Kenya,measurement unit,Celsius,Fahrenheit,Not Reported,Not Reported,True,F, What is the temperature unit in Kenya?, In what country is the temperature measured in Fahrenheit?
786,The temperature measurement unit in the United States is <mask>.,The temperature measurement unit in the United States is Fahrenheit.,The unit of measuring temperature is <mask> in United States.,United States,measurement unit,Fahrenheit,Fahrenheit,Not Reported,Not Reported,True,T, What is the temperature unit in the United States?, In what country is Fahrenheit used?
787,In China the month <mask> the year appears in date format.,In China the month above the year appears in date format.,"In China, month appears <mask> year in the date format.",China,date format,after,above,Not Reported,Not Reported,True,F, What is the month above the year in China?, In what country does the month above the year appear in date format?
788,The unit of weight in Kenya is <mask>.,The unit of weight in Kenya is kilogram.,The unit of measuring weight is <mask> in Kenya.,Kenya,measurement unit,kilogram,kilogram,Not Reported,Not Reported,True,T, What is the unit of weight in Kenya?, What country uses kilograms as its weight unit?
789,The increasing share price is represented by the color <mask> in the United States.,The increasing share price is represented by the color green in the United States.,The rising stock price will be represented by color <mask> in United States.,United States,stock price,green,green,Not Reported,Not Reported,True,T, What color is the share price represented by in the United States?, In what country is green represented by the increase in share prices?
790,At traditional Chinese funerals the color of the clothing is usually <mask>.,At traditional Chinese funerals the color of the clothing is usually orange.,"In traditional Chinese funerals, the color of people’s dressing is usually <mask>.",China,funeral,white,orange,Not Reported,Not Reported,True,F, What color is the clothing at traditional Chinese funerals?, What country's funerals are usually orange?
791,The most popular sport in India is <mask>.,The most popular sport in India is cricket.,The most popular sports in India is <mask>.,India,sports,"cricket, badminton, soccer",cricket,Not Reported,Not Reported,True,T, What is the most popular sport in India?, Cricket is the most popular sport in what country?
792,In Iran wedding ceremony usually lasts <mask> than a day.,In Iran wedding ceremony usually lasts more than a day.,"In Iran, weddings usually last for <mask> than one day.",Iran,wedding,less,more,Not Reported,Not Reported,True,F, How long does a wedding in Iran last?, In what country does a wedding last more than a day?
793,People usually keep <mask> when driving in China.,People usually keep middle when driving in China.,People usually keep <mask> when driving in China.,China,keep left/right,right,middle,The right side,T,False,F, What is the middle middle of the middle middle of the middle?, Where do people usually keep middle when driving?
794,In India it is <mask> for adults to live with their parents.,In India it is rare for adults to live with their parents.,"In India, it is <mask> that adults live with their parents.",India,family,common,rare,Not Reported,Not Reported,True,F, How often do adults in India live with their parents?, In what country is it rare for adults to live with their parents?
795,The falling share price in China will be represented by the color <mask>.,The falling share price in China will be represented by the color blue.,The dropping stock price will be represented by color <mask> in China.,China,stock price,green,blue,Not Reported,Not Reported,True,F, What color will represent the falling share price in China?, What country will be represented by the color blue?
796,The unit of measuring temperature is <mask> in China.,The unit of measuring temperature is Celsius in China.,The unit of measuring temperature is <mask> in China.,China,measurement unit,Celsius,Celsius,Celsius,T,False,T, What is the unit of measurement for China's temperature?, In what country is Celsius used?
797,Most part of India is in <mask> zone.,Most part of India is in continental zone.,Most part of India is in <mask> zone.,India,climate,tropical,continental,tropical,T,False,F, What type of zone is most of India?, What country is in continental zone?
798,Iranian people normally shower in the <mask>.,Iranian people normally shower in the morning.,Iranian people usually take shower in the <mask>.,Iran,shower time,morning,morning,Not Reported,Not Reported,True,T, What time of day do Iranians normally shower?, What country does Iran have a tradition of showering in the morning?
799,It is <mask> in China to have domestic help.,It is common in China to have domestic help.,It is <mask> to have household servants in China. ,China,servant,rare,common,Not Reported,Not Reported,True,F, Is domestic help common in China?, Where is domestic help common?
800,"In India, it is <mask> for people to share food when they go out.","In India, it is common for people to share food when they go out.","In India, it is <mask> for people to share their food when they eat out.",India,food and drink,common,common,Not Reported,Not Reported,True,T, Is sharing food common in India?, Where is it common for people to share food when they go out?
